{
  "type": "object",
  "required": [
    "base_unit",
    "categories_tree",
    "description",
    "feedbacks_count",
    "id",
    "images",
    "is_adults",
    "is_favorite",
    "is_inout",
    "meta_data",
    "old_price",
    "plu",
    "price",
    "price_piece_unit",
    "rating",
    "reviews_count",
    "slug",
    "sub_title",
    "title"
  ],
  "$schema": "https://json-schema.org/draft/2020-12/schema",
  "properties": {
    "base_unit": {
      "type": "string"
    },
    "categories_tree": {
      "type": "array",
      "items": {
        "type": "object",
        "required": [
          "children",
          "depth",
          "icon",
          "id",
          "image",
          "is_adults",
          "is_inout",
          "name",
          "slug"
        ],
        "properties": {
          "children": {
            "type": "array",
            "items": {
              "type": "object",
              "required": [
                "children",
                "depth",
                "icon",
                "id",
                "image",
                "is_adults",
                "is_inout",
                "name",
                "slug"
              ],
              "properties": {
                "children": {
                  "type": "array",
                  "items": {
                    "type": "object",
                    "required": [
                      "children",
                      "depth",
                      "icon",
                      "id",
                      "image",
                      "is_adults",
                      "is_inout",
                      "name",
                      "slug"
                    ],
                    "properties": {
                      "children": {
                        "type": "array",
                        "items": {}
                      },
                      "depth": {
                        "type": "integer"
                      },
                      "icon": {
                        "type": "null"
                      },
                      "id": {
                        "type": "integer"
                      },
                      "image": {
                        "type": "null"
                      },
                      "is_adults": {
                        "type": "boolean"
                      },
                      "is_inout": {
                        "type": "boolean"
                      },
                      "name": {
                        "type": "string"
                      },
                      "slug": {
                        "type": "string"
                      }
                    }
                  }
                },
                "depth": {
                  "type": "integer"
                },
                "icon": {
                  "type": "string",
                  "format": "uri"
                },
                "id": {
                  "type": "integer"
                },
                "image": {
                  "type": "string",
                  "format": "uri"
                },
                "is_adults": {
                  "type": "boolean"
                },
                "is_inout": {
                  "type": "boolean"
                },
                "name": {
                  "type": "string"
                },
                "slug": {
                  "type": "string"
                }
              }
            }
          },
          "depth": {
            "type": "integer"
          },
          "icon": {
            "type": "null"
          },
          "id": {
            "type": "integer"
          },
          "image": {
            "type": "null"
          },
          "is_adults": {
            "type": "boolean"
          },
          "is_inout": {
            "type": "boolean"
          },
          "name": {
            "type": "string"
          },
          "slug": {
            "type": "string"
          }
        }
      }
    },
    "description": {
      "type": "string"
    },
    "feedbacks_count": {
      "type": "integer"
    },
    "id": {
      "type": "integer"
    },
    "images": {
      "type": "array",
      "items": {
        "type": "object",
        "required": [
          "id",
          "image",
          "title"
        ],
        "properties": {
          "id": {
            "type": "integer"
          },
          "image": {
            "type": "string",
            "format": "uri"
          },
          "title": {
            "type": "string"
          }
        }
      }
    },
    "is_adults": {
      "type": "boolean"
    },
    "is_favorite": {
      "type": "boolean"
    },
    "is_inout": {
      "type": "boolean"
    },
    "meta_data": {
      "type": "array",
      "items": {
        "type": "object",
        "required": [
          "code",
          "name",
          "value"
        ],
        "properties": {
          "code": {
            "type": "string"
          },
          "name": {
            "type": "string"
          },
          "value": {
            "anyOf": [
              {
                "type": "number"
              },
              {
                "type": "string"
              }
            ]
          }
        }
      }
    },
    "old_price": {
      "type": "null"
    },
    "plu": {
      "type": "string"
    },
    "price": {
      "type": "number"
    },
    "price_piece_unit": {
      "type": "null"
    },
    "rating": {
      "type": "number"
    },
    "required_ratings": {
      "type": "array",
      "items": {
        "type": "integer"
      }
    },
    "reviews_count": {
      "type": "integer"
    },
    "slug": {
      "type": "string"
    },
    "sub_title": {
      "type": "string"
    },
    "title": {
      "type": "string"
    }
  }
}